<?xml version="1.0" encoding="UTF-8"?>
<?xml-stylesheet type="text/xsl" href="./xsl/equiposdefutbol.xsl"?>
<equiposdefutbol xmlns:xsi="http://www.w3.org/2001/XMLSchema-instance" xsi:noNamespaceSchemaLocation="file:///C:/Users/Alumnos/Documents/practica%20E2/xsd-dtd/equiposdefutbol.xsd">
	<equipo nomequi="CD Tenerife">
		<ciudad>S/C de Tenerife</ciudad>
		<estadio>Heliodoro Rodríguez López</estadio>
		<socios>13.856</socios>
		<jugadores>
			<jugador equi="tenerife" posicion="portero">
				<nombre>Daniel Hernández</nombre>
				<nacionalidad>venezolana</nacionalidad>
				<foto>dani.jpg</foto>
				<datos>https://www.laliga.es/jugador/dani-hernandez</datos>
			</jugador>
			<jugador equi="tenerife" posicion="defensa">
				<nombre>Luis Jesús Pérez</nombre>
				<nacionalidad>española</nacionalidad>
				<foto>luisperez.jpg</foto>
				<datos>https://www.laliga.es/jugador/luis-perez</datos>
			</jugador>
			<jugador equi="tenerife" posicion="defensa">
				<nombre>Héctor Hernández</nombre>
				<nacionalidad>española</nacionalidad>
				<foto>hector.jpg</foto>
				<datos>https://www.laliga.es/jugador/hector-hernandez</datos>
			</jugador>
			<jugador equi="tenerife" posicion="defensa">
				<nombre>Samuel Geoffroy</nombre>
				<nacionalidad>francesa</nacionalidad>
				<foto>samuel.jpg</foto>
				<datos>https://www.laliga.es/jugador/camille</datos>
			</jugador>
			<jugador equi="tenerife" posicion="defensa">
				<nombre>Alberto Jiménez</nombre>
				<nacionalidad>española</nacionalidad>
				<foto>alberto.jpg</foto>
				<datos>https://www.laliga.es/jugador/alberto</datos>
			</jugador>
			<jugador equi="tenerife" posicion="centrocampista">
				<nombre>Luis Milla Manzanilla</nombre>
				<nacionalidad>española</nacionalidad>
				<foto>luismilla.jpg</foto>
				<datos>https://www.laliga.es/jugador/milla-1</datos>
			</jugador>
			<jugador equi="tenerife" posicion="centrocampista">
				<nombre>Jesús Manuel Santana</nombre>
				<nacionalidad>española</nacionalidad>
				<foto>susosantana.jpg</foto>
				<datos>https://www.laliga.es/jugador/suso-santana</datos>
			</jugador>
			<jugador equi="tenerife" posicion="centrocampista">
				<nombre>Uroš Račić Lesct</nombre>
				<nacionalidad>servia</nacionalidad>
				<foto>uros.jpg</foto>
				<datos>https://www.laliga.es/jugador/p228611-28917180704</datos>
			</jugador>
			<jugador equi="tenerife" posicion="centrocampista">
				<nombre>Francisco Montañés</nombre>
				<nacionalidad>española</nacionalidad>
				<foto>francisco.jpg</foto>
				<datos>https://www.laliga.es/jugador/paco-montanes</datos>
			</jugador>
			<jugador equi="tenerife" posicion="delantero">
				<nombre>Filip Malbašić</nombre>
				<nacionalidad>servia</nacionalidad>
				<foto>filip.jpg</foto>
				<datos>https://www.laliga.es/jugador/malbasic</datos>
			</jugador>
			<jugador equi="tenerife" posicion="delantero">
				<nombre>José Manuel García</nombre>
				<nacionalidad>española</nacionalidad>
				<foto>josemanuel.jpg</foto>
				<datos>https://www.laliga.es/jugador/malbasic</datos>
			</jugador>
			<jugador equi="tenerife" posicion="delantero">
				<nombre>Alexander Mesa</nombre>
				<nacionalidad>española</nacionalidad>
				<foto>nano.jpg</foto>
				<datos>https://www.laliga.es/jugador/nano-1</datos>
			</jugador>
		</jugadores>
	</equipo>
	<equipo nomequi="UD Las Palmas">
		<ciudad>Las Palmas de Gran Canaria</ciudad>
		<estadio>Estadio de Gran Canaria</estadio>
		<socios>18.456</socios>
		<jugadores>
			<jugador equi="laspalmas" posicion="portero">
				<nombre>Raúl Fernández</nombre>
				<nacionalidad>española</nacionalidad>
				<foto>raul.jpg</foto>
				<datos>https://www.laliga.es/jugador/raul</datos>
			</jugador>
			<jugador equi="laspalmas" posicion="defensa">
				<nombre>Alberto de la Bella</nombre>
				<nacionalidad>española</nacionalidad>
				<foto>alberto.jpg</foto>
				<datos>https://www.laliga.es/jugador/de-la-bella</datos>
			</jugador>
			<jugador equi="laspalmas" posicion="defensa">
				<nombre>David García Santana</nombre>
				<nacionalidad>española</nacionalidad>
				<foto>david.jpg</foto>
				<datos>https://www.laliga.es/jugador/david-garcia-s</datos>
			</jugador>
			<jugador equi="laspalmas" posicion="defensa">
				<nombre>David Omar Rodríguez</nombre>
				<nacionalidad>española</nacionalidad>
				<foto>davidomar.jpg</foto>
				<datos>https://www.laliga.es/jugador/deivid</datos>
			</jugador>
			<jugador equi="laspalmas" posicion="defensa">
				<nombre>Juan Torres Ruiz</nombre>
				<nacionalidad>colombiana</nacionalidad>
				<foto>juantorres.jpg</foto>
				<datos>https://www.laliga.es/jugador/cala</datos>
			</jugador>
			<jugador equi="laspalmas" posicion="centrocampista">
				<nombre>Javi Castellano</nombre>
				<nacionalidad>española</nacionalidad>
				<foto>javicastellano.jpg</foto>
				<datos>https://www.laliga.es/jugador/javi-castellano</datos>
			</jugador>
			<jugador equi="laspalmas" posicion="centrocampista">
				<nombre>Iñigo Ruiz de Galarreta</nombre>
				<nacionalidad>española</nacionalidad>
				<foto>inigoruiz.jpg</foto>
				<datos>https://www.laliga.es/jugador/ruiz-de-galarreta</datos>
			</jugador>
			<jugador equi="laspalmas" posicion="centrocampista">
				<nombre>Slavoljub Srnić</nombre>
				<nacionalidad>servia</nacionalidad>
				<foto>slavol.jpg</foto>
				<datos>https://www.laliga.es/jugador/slavoljub-srnic</datos>
			</jugador>
			<jugador equi="laspalmas" posicion="centrocampista">
				<nombre>Gabriel Martín</nombre>
				<nacionalidad>argentina</nacionalidad>
				<foto>gabriel.jpg</foto>
				<datos>https://www.laliga.es/jugador/penalba</datos>
			</jugador>
			<jugador equi="laspalmas" posicion="delantero">
				<nombre>Rubén Castro</nombre>
				<nacionalidad>española</nacionalidad>
				<foto>rubencastro.jpg</foto>
				<datos>https://www.laliga.es/jugador/ruben-castro</datos>
			</jugador>
			<jugador equi="laspalmas" posicion="delantero">
				<nombre>Tomas Pekhart</nombre>
				<nacionalidad>española</nacionalidad>
				<foto>tomas.jpg</foto>
				<datos>https://www.laliga.es/jugador/tomas-pekhart</datos>
			</jugador>
			<jugador equi="laspalmas" posicion="delantero">
				<nombre>Ezequiel Araujo</nombre>
				<nacionalidad>argentina</nacionalidad>
				<foto>araujo.jpg</foto>
				<datos>https://www.laliga.es/jugador/araujo</datos>
			</jugador>
		</jugadores>
	</equipo>
	<equipo nomequi="Albacete Balompié SAD">
		<ciudad>Albacete</ciudad>
		<estadio>Carlos Belmonte</estadio>
		<socios>15.490</socios>
		<jugadores>
			<jugador equi="albacete" posicion="portero">
				<nombre>José Antonio Caro</nombre>
				<nacionalidad>española</nacionalidad>
				<foto>caro.jpg</foto>
				<datos>https://www.laliga.es/jugador/caro-1</datos>
			</jugador>
			<jugador equi="albacete" posicion="defensa">
				<nombre>Álvaro Arroyo</nombre>
				<nacionalidad>española</nacionalidad>
				<foto>arroyo.jpg</foto>
				<datos>https://www.laliga.es/jugador/a-arroyo</datos>
			</jugador>
			<jugador equi="albacete" posicion="defensa">
				<nombre>Francisco García</nombre>
				<nacionalidad>española</nacionalidad>
				<foto>francisco.jpg</foto>
				<datos>https://www.laliga.es/jugador/fran-garcia</datos>
			</jugador>
			<jugador equi="albacete" posicion="defensa">
				<nombre>Ezequiel Gorosito</nombre>
				<nacionalidad>argentina</nacionalidad>
				<foto>gorosito.jpg</foto>
				<datos>https://www.laliga.es/jugador/nicolas-gorosito</datos>
			</jugador>
			<jugador equi="albacete" posicion="defensa">
				<nombre> Juan Gentiletti </nombre>
				<nacionalidad>italana</nacionalidad>
				<foto>gentileti.jpg</foto>
				<datos>https://www.laliga.es/jugador/santiago-gentiletti</datos>
			</jugador>
			<jugador equi="albacete" posicion="centrocampista">
				<nombre>Sulleyman Muntari</nombre>
				<nacionalidad>francesa</nacionalidad>
				<foto>muntari.jpg</foto>
				<datos>https://www.laliga.es/jugador/sulley-muntari</datos>
			</jugador>
			<jugador equi="albacete" posicion="centrocampista">
				<nombre>Néstor Susaeta</nombre>
				<nacionalidad>española</nacionalidad>
				<foto>susaeta.jpg</foto>
				<datos>https://www.laliga.es/jugador/susaeta-1</datos>
			</jugador>
			<jugador equi="albacete" posicion="centrocampista">
				<nombre>Eugeni Valderrama</nombre>
				<nacionalidad>española</nacionalidad>
				<foto>eugeni.jpg</foto>
				<datos>https://www.laliga.es/jugador/eugeni</datos>
			</jugador>
			<jugador equi="albacete" posicion="centrocampista">
				<nombre>Daniel Torres Rojas</nombre>
				<nacionalidad>española</nacionalidad>
				<foto>danitorres.jpg</foto>
				<datos>https://www.laliga.es/jugador/daniel-torres</datos>
			</jugador>
			<jugador equi="albacete" posicion="delantero">
				<nombre>Ballou Jean-Yves</nombre>
				<nacionalidad>francesa</nacionalidad>
				<foto>ballou.jpg</foto>
				<datos>https://www.laliga.es/jugador/ballou-tabla</datos>
			</jugador>
			<jugador equi="albacete" posicion="delantero">
				<nombre>Roman Zozulia</nombre>
				<nacionalidad>argentina</nacionalidad>
				<foto>roman.jpg</foto>
				<datos>https://www.laliga.es/jugador/roman-zozulya</datos>
			</jugador>
			<jugador equi="albacete" posicion="delantero">
				<nombre>Javier Acuña Caballero</nombre>
				<nacionalidad>española</nacionalidad>
				<foto>acuna.jpg</foto>
				<datos>https://www.laliga.es/jugador/acuna</datos>
			</jugador>
		</jugadores>
	</equipo>
</equiposdefutbol>
